{
  "schema_version": "2.0",
  "manifest_id": "bundle-release-fixture-run-001",
  "plugin_version": "1.2.2",
  "workflow_run_id": "release-fixture-run-001",
  "generated_at": "2026-09-08T05:14:35Z",
  "entries": [
    {
      "artifact_type": "claim_ledger",
      "path": "claim_ledger.json",
      "sha256": "0ab4a0c1e355d981eda25af4abcd326234ac32503c61aa8e02ca8c6fede51742",
      "size_bytes": 1707,
      "schema_version": "2.0",
      "plugin_version": "1.2.2",
      "workflow_run_id": "release-fixture-run-001",
      "required_for_release": true,
      "generated_at": "2026-09-08T05:14:35Z"
    },
    {
      "artifact_type": "claim_support_matrix",
      "path": "claim_support_matrix.json",
      "sha256": "95eaefa7db23c280ab9ad798f2755f5b72e8c68a53fa69d649d335d4bc20eb6a",
      "size_bytes": 1385,
      "schema_version": "2.0",
      "plugin_version": "1.2.2",
      "workflow_run_id": "release-fixture-run-001",
      "required_for_release": false,
      "generated_at": "2026-09-08T05:14:35Z"
    },
    {
      "artifact_type": "source_S_001",
      "path": "evidence/source-S-001.txt",
      "sha256": "dff21058422ace53b7d10ea0c9fac63e222cb671a965319ca065dd0d83c766eb",
      "size_bytes": 105,
      "schema_version": "not-applicable",
      "plugin_version": "1.2.2",
      "workflow_run_id": "release-fixture-run-001",
      "required_for_release": false,
      "generated_at": "2026-09-08T05:14:35Z"
    },
    {
      "artifact_type": "SPAN_S_001_001_locator",
      "path": "evidence/SPAN-S-001-001-locator.json",
      "sha256": "1374081e96aa4f9983e2105303300a5f630eb9a1ad3f5db19481fec5720d520c",
      "size_bytes": 568,
      "schema_version": "not-applicable",
      "plugin_version": "1.2.2",
      "workflow_run_id": "release-fixture-run-001",
      "required_for_release": false,
      "generated_at": "2026-09-08T05:14:35Z"
    },
    {
      "artifact_type": "final",
      "path": "final.md",
      "sha256": "8eb055362c38eab00bbdec5dc0457a88bc7a47c8c95ee3d5d340a9a0fa3566fe",
      "size_bytes": 275,
      "schema_version": "not-applicable",
      "plugin_version": "1.2.2",
      "workflow_run_id": "release-fixture-run-001",
      "required_for_release": true,
      "generated_at": "2026-09-08T05:14:35Z"
    },
    {
      "artifact_type": "lead_decision",
      "path": "lead_decision.json",
      "sha256": "a1ddd2f3619c28d78a095b15502854a7ff1bc0260e399158142fb8aa507228c5",
      "size_bytes": 1576,
      "schema_version": "2.0",
      "plugin_version": "1.2.2",
      "workflow_run_id": "release-fixture-run-001",
      "required_for_release": false,
      "generated_at": "2026-09-08T05:14:35Z"
    },
    {
      "artifact_type": "post_write_validation",
      "path": "post_write_validation.json",
      "sha256": "d8c57481caf84bc10de2508b370ddbdb6a98448d38adeddf4b4cc0a0d7f8fa38",
      "size_bytes": 2083,
      "schema_version": "2.0",
      "plugin_version": "1.2.2",
      "workflow_run_id": "release-fixture-run-001",
      "required_for_release": true,
      "generated_at": "2026-09-08T05:14:35Z"
    },
    {
      "artifact_type": "results_integration",
      "path": "results_integration.json",
      "sha256": "e0f364e850a777aab673b81da62e8d72df2808e7fc839a540970cd5c748468f1",
      "size_bytes": 2428,
      "schema_version": "2.0",
      "plugin_version": "1.2.2",
      "workflow_run_id": "release-fixture-run-001",
      "required_for_release": false,
      "generated_at": "2026-09-08T05:14:35Z"
    },
    {
      "artifact_type": "external_tool_review_prompt",
      "path": "review/external-tool-review-prompt.md",
      "sha256": "adaca75fff873e3e4dd11349585c1b5141313469759634fbed62a7ea02b20784",
      "size_bytes": 561,
      "schema_version": "not-applicable",
      "plugin_version": "1.2.2",
      "workflow_run_id": "release-fixture-run-001",
      "required_for_release": false,
      "generated_at": "2026-09-08T05:14:35Z"
    },
    {
      "artifact_type": "external_tool_review",
      "path": "review/external-tool-review.md",
      "sha256": "9cfba30e2c0a45bff7b3b7050d52f8349661aaf83225219bc99824c5f35a5b4e",
      "size_bytes": 1119,
      "schema_version": "not-applicable",
      "plugin_version": "1.2.2",
      "workflow_run_id": "release-fixture-run-001",
      "required_for_release": false,
      "generated_at": "2026-09-08T05:14:35Z"
    },
    {
      "artifact_type": "review_runtime_receipt",
      "path": "review/review-runtime-receipt.json",
      "sha256": "8b6d3675fc63ee191f8ac1c62e7c3df7dfaca262a81da9ab445223b7c293c7cf",
      "size_bytes": 1108,
      "schema_version": "2.0",
      "plugin_version": "1.2.2",
      "workflow_run_id": "release-fixture-run-001",
      "required_for_release": false,
      "generated_at": "2026-09-08T05:14:35Z"
    },
    {
      "artifact_type": "review_artifact_manifest",
      "path": "review_artifact_manifest.json",
      "sha256": "e21c63f27ec303723f75fe6ef83f48990fe566ad2d107c1445c28961b6e6d800",
      "size_bytes": 3244,
      "schema_version": "2.0",
      "plugin_version": "1.2.2",
      "workflow_run_id": "release-fixture-run-001",
      "required_for_release": false,
      "generated_at": "2026-09-08T05:14:35Z"
    },
    {
      "artifact_type": "run_state",
      "path": "run_state.json",
      "sha256": "3fd41866a64cf8391a588bb11dcd9adc416c6cd41b67ebe88b3a3de03d546c54",
      "size_bytes": 2611,
      "schema_version": "2.0",
      "plugin_version": "1.2.2",
      "workflow_run_id": "release-fixture-run-001",
      "required_for_release": true,
      "generated_at": "2026-09-08T05:14:35Z"
    },
    {
      "artifact_type": "runtime_capability_preflight",
      "path": "runtime_capability_preflight.json",
      "sha256": "a73b9fd8511e16b56771b2f2dd34051c01ffe7facbf94d14da0057400620f980",
      "size_bytes": 2580,
      "schema_version": "2.0",
      "plugin_version": "1.2.2",
      "workflow_run_id": "release-fixture-run-001",
      "required_for_release": true,
      "generated_at": "2026-09-08T05:14:35Z"
    },
    {
      "artifact_type": "source_corpus",
      "path": "source_corpus.json",
      "sha256": "dd83e3d8384751768555b197119cec06acce1aae3a2bd569599c485739c7e6e5",
      "size_bytes": 2640,
      "schema_version": "2.0",
      "plugin_version": "1.2.2",
      "workflow_run_id": "release-fixture-run-001",
      "required_for_release": true,
      "generated_at": "2026-09-08T05:14:35Z"
    },
    {
      "artifact_type": "source_verification",
      "path": "source_verification.json",
      "sha256": "d3dcbfa2700015846d373939ef3d29f92f98ebef75ff747bece6ba8b7bcdc9c6",
      "size_bytes": 1291,
      "schema_version": "2.0",
      "plugin_version": "1.2.2",
      "workflow_run_id": "release-fixture-run-001",
      "required_for_release": false,
      "generated_at": "2026-09-08T05:14:35Z"
    },
    {
      "artifact_type": "stage_evaluation",
      "path": "stage_evaluation.json",
      "sha256": "33ef80976b80c0e74620657e6f45d7420a1b9cdd9e104d2ccb51bc8c23910da6",
      "size_bytes": 569,
      "schema_version": "2.0",
      "plugin_version": "1.2.2",
      "workflow_run_id": "release-fixture-run-001",
      "required_for_release": true,
      "generated_at": "2026-09-08T05:14:35Z"
    },
    {
      "artifact_type": "tool_call_ledger",
      "path": "tool_call_ledger.json",
      "sha256": "dceffcbf3525ef566c702748cafd2c7dd6a5149e922c72fd4397d4cc7d7f884f",
      "size_bytes": 1178,
      "schema_version": "2.0",
      "plugin_version": "1.2.2",
      "workflow_run_id": "release-fixture-run-001",
      "required_for_release": false,
      "generated_at": "2026-09-08T05:14:35Z"
    }
  ]
}
